{
  "cards": [
    {
      "boundary_note": "Educational only. Banking policy and consumer-finance actions can depend on jurisdiction, account terms, and current rules, so use primary regulators or qualified professionals for decisions.",
      "category": "foundations",
      "connections": [
        {
          "card_id": "bank-02-commercial-banks",
          "label": "Prepares for Commercial banks.",
          "type": "prepares-for"
        },
        {
          "card_id": "bank-04-payment-systems",
          "label": "Prepares for Payment systems.",
          "type": "prepares-for"
        }
      ],
      "core_idea": [
        "Money is useful because people expect others to accept it later, while credit extends that trust across time.",
        "Banks sit between present cash and future repayment, so the banking system is partly plumbing and partly a confidence network."
      ],
      "difficulty": 1,
      "example": "A paycheck deposit, a card payment, and a mortgage all rely on promises being recorded and settled.",
      "foundational_priority": 1,
      "id": "bank-01-money-credit-and-trust",
      "importance": 0.96,
      "key_takeaway": "Banking starts with trusted records of who can pay whom.",
      "media": null,
      "prerequisites": [],
      "review_prompts": [
        {
          "answer_hint": "Banking starts with trusted records of who can pay whom.",
          "kind": "recall",
          "prompt": "In your own words, explain \"Money, credit, and trust\" and name one way someone could misunderstand it."
        },
        {
          "answer_hint": "A paycheck deposit, a card payment, and a mortgage all rely on promises being recorded and settled.",
          "kind": "application",
          "prompt": "Look at the example for \"Money, credit, and trust\". What detail does it show that the definition alone would miss?"
        }
      ],
      "source_refs": [
        "bank-fed-payments",
        "bank-bis-cpmi"
      ],
      "title": "Money, credit, and trust"
    },
    {
      "boundary_note": "Educational only. Banking policy and consumer-finance actions can depend on jurisdiction, account terms, and current rules, so use primary regulators or qualified professionals for decisions.",
      "category": "foundations",
      "connections": [
        {
          "card_id": "bank-01-money-credit-and-trust",
          "label": "Builds on Money, credit, and trust.",
          "type": "prerequisite"
        },
        {
          "card_id": "bank-03-deposits-as-bank-liabilities",
          "label": "Prepares for Deposits as bank liabilities.",
          "type": "prepares-for"
        },
        {
          "card_id": "bank-05-bank-balance-sheets",
          "label": "Prepares for Bank balance sheets.",
          "type": "prepares-for"
        },
        {
          "card_id": "bank-39-money-laundering-controls",
          "label": "Prepares for Money laundering controls.",
          "type": "prepares-for"
        }
      ],
      "core_idea": [
        "A commercial bank is a private institution that takes deposits, makes loans, provides payment access, and manages risk.",
        "It earns by transforming funding into assets while meeting rules, withdrawals, and payment obligations."
      ],
      "difficulty": 1,
      "example": "A neighborhood bank account is both a service to the customer and a funding source for the bank.",
      "foundational_priority": 0.98,
      "id": "bank-02-commercial-banks",
      "importance": 0.95,
      "key_takeaway": "A bank is not a vault; it is a regulated balance-sheet business.",
      "media": null,
      "prerequisites": [
        "bank-01-money-credit-and-trust"
      ],
      "review_prompts": [
        {
          "answer_hint": "A bank is not a vault; it is a regulated balance-sheet business.",
          "kind": "recall",
          "prompt": "In your own words, explain \"Commercial banks\" and name one way someone could misunderstand it."
        },
        {
          "answer_hint": "A neighborhood bank account is both a service to the customer and a funding source for the bank.",
          "kind": "application",
          "prompt": "Look at the example for \"Commercial banks\". What detail does it show that the definition alone would miss?"
        }
      ],
      "source_refs": [
        "bank-fed-payments",
        "bank-bis-cpmi"
      ],
      "title": "Commercial banks"
    },
    {
      "boundary_note": "Educational only. Banking policy and consumer-finance actions can depend on jurisdiction, account terms, and current rules, so use primary regulators or qualified professionals for decisions.",
      "category": "foundations",
      "connections": [
        {
          "card_id": "bank-02-commercial-banks",
          "label": "Builds on Commercial banks.",
          "type": "prerequisite"
        },
        {
          "card_id": "bank-05-bank-balance-sheets",
          "label": "Prepares for Bank balance sheets.",
          "type": "prepares-for"
        },
        {
          "card_id": "bank-06-fractional-reserve-banking",
          "label": "Prepares for Fractional-reserve banking.",
          "type": "prepares-for"
        },
        {
          "card_id": "bank-15-maturity-transformation",
          "label": "Prepares for Maturity transformation.",
          "type": "prepares-for"
        },
        {
          "card_id": "bank-40-consumer-protection",
          "label": "Prepares for Consumer protection.",
          "type": "prepares-for"
        }
      ],
      "core_idea": [
        "A deposit feels like your asset, but on the bank balance sheet it is money the bank owes you.",
        "That liability must be honored through withdrawals, transfers, or payments even though the bank has invested or lent much of the funding."
      ],
      "difficulty": 2,
      "example": "When you see 500 dollars in checking, the bank records a matching obligation to let you spend it.",
      "foundational_priority": 0.96,
      "id": "bank-03-deposits-as-bank-liabilities",
      "importance": 0.94,
      "key_takeaway": "Deposits are promises by the bank, not labeled bundles of cash in a drawer.",
      "media": null,
      "prerequisites": [
        "bank-02-commercial-banks"
      ],
      "review_prompts": [
        {
          "answer_hint": "Deposits are promises by the bank, not labeled bundles of cash in a drawer.",
          "kind": "recall",
          "prompt": "In your own words, explain \"Deposits as bank liabilities\" and name one way someone could misunderstand it."
        },
        {
          "answer_hint": "When you see 500 dollars in checking, the bank records a matching obligation to let you spend it.",
          "kind": "application",
          "prompt": "Look at the example for \"Deposits as bank liabilities\". What detail does it show that the definition alone would miss?"
        }
      ],
      "source_refs": [
        "bank-fed-payments",
        "bank-bis-cpmi"
      ],
      "title": "Deposits as bank liabilities"
    },
    {
      "boundary_note": "Educational only. Banking policy and consumer-finance actions can depend on jurisdiction, account terms, and current rules, so use primary regulators or qualified professionals for decisions.",
      "category": "mechanisms",
      "connections": [
        {
          "card_id": "bank-01-money-credit-and-trust",
          "label": "Builds on Money, credit, and trust.",
          "type": "prerequisite"
        },
        {
          "card_id": "bank-11-reserves-and-settlement-balances",
          "label": "Prepares for Reserves and settlement balances.",
          "type": "prepares-for"
        },
        {
          "card_id": "bank-12-interbank-settlement",
          "label": "Prepares for Interbank settlement.",
          "type": "prepares-for"
        },
        {
          "card_id": "bank-45-central-bank-digital-currencies",
          "label": "Prepares for Central bank digital currencies.",
          "type": "prepares-for"
        },
        {
          "card_id": "bank-46-real-time-payments",
          "label": "Prepares for Real-time payments.",
          "type": "prepares-for"
        }
      ],
      "core_idea": [
        "A payment system is the rulebook and infrastructure that moves claims between people, banks, merchants, and central-bank accounts.",
        "The visible tap or transfer hides authorization, clearing, settlement, fraud controls, and final record updates."
      ],
      "difficulty": 2,
      "example": "Buying groceries with a debit card can involve a merchant bank, card network, your bank, and settlement records.",
      "foundational_priority": 0.9,
      "id": "bank-04-payment-systems",
      "importance": 0.9,
      "key_takeaway": "Payments are coordinated record changes, not just money flying through wires.",
      "media": null,
      "prerequisites": [
        "bank-01-money-credit-and-trust"
      ],
      "review_prompts": [
        {
          "answer_hint": "Payments are coordinated record changes, not just money flying through wires.",
          "kind": "recall",
          "prompt": "In your own words, explain \"Payment systems\" and name one way someone could misunderstand it."
        },
        {
          "answer_hint": "Buying groceries with a debit card can involve a merchant bank, card network, your bank, and settlement records.",
          "kind": "application",
          "prompt": "Look at the example for \"Payment systems\". What detail does it show that the definition alone would miss?"
        }
      ],
      "source_refs": [
        "bank-fed-monetary-policy",
        "bank-fed-payments",
        "bank-bis-cpmi"
      ],
      "title": "Payment systems"
    },
    {
      "boundary_note": "Educational only. Banking policy and consumer-finance actions can depend on jurisdiction, account terms, and current rules, so use primary regulators or qualified professionals for decisions.",